{
  "schema_version": "1.0",
  "decision_case_id": "DC_00295",
  "candidate_set_id": "CSET_00295",
  "ground_truth_rule": {
    "rule_type": "category_separate",
    "target_attribute": "product_category=electronics",
    "priority": 1,
    "hard_or_soft": "hard",
    "thresholds": {
      "separate_from": "weight_class=heavy",
      "contact_tolerance_mm": 0
    },
    "canonical": "电子产品箱不得与重物箱直接接触或形成上下支撑关系。",
    "paraphrases": [
      "必须将电子货箱和重箱隔开，不能相互贴靠或叠放。",
      "电子产品不可直接邻接重物，也不能与重物上下承托。"
    ]
  },
  "geometry_reference": {
    "rejection_histogram": {
      "com_outside_support": 8,
      "insufficient_support": 105,
      "out_of_bounds": 621,
      "overlap": 264,
      "overload": 25
    },
    "pareto_candidate_fingerprints": [
      "96abd8c5afa9990ba5c7ac7e",
      "fee01764ccdaacc1ef3d670d"
    ],
    "pareto_recall_at_k": 1.0,
    "geometry_oracle_fingerprint": "96abd8c5afa9990ba5c7ac7e",
    "geometry_oracle_score": 0.7187126,
    "epsilon_optimal_recall_at_k": true
  },
  "candidate_evaluations": [
    {
      "candidate_id": "cand_96abd8c5afa9",
      "geometry_score": 0.7187126,
      "semantic_score_components": {
        "category_separate": 0.666667
      },
      "soft_utility": 0.666667,
      "hard_violations": [
        "electronics_heavy_contact:1"
      ]
    },
    {
      "candidate_id": "cand_fee01764ccda",
      "geometry_score": 0.7184418,
      "semantic_score_components": {
        "category_separate": 1.0
      },
      "soft_utility": 1.0,
      "hard_violations": []
    },
    {
      "candidate_id": "cand_ad4543cf1e8c",
      "geometry_score": 0.5846726,
      "semantic_score_components": {
        "category_separate": 1.0
      },
      "soft_utility": 1.0,
      "hard_violations": []
    },
    {
      "candidate_id": "cand_fca823d4adac",
      "geometry_score": 0.57896045,
      "semantic_score_components": {
        "category_separate": 1.0
      },
      "soft_utility": 1.0,
      "hard_violations": []
    },
    {
      "candidate_id": "cand_4fb8b9d0a90c",
      "geometry_score": 0.71821155,
      "semantic_score_components": {
        "category_separate": 1.0
      },
      "soft_utility": 1.0,
      "hard_violations": []
    },
    {
      "candidate_id": "cand_c454daebdba1",
      "geometry_score": 0.71774525,
      "semantic_score_components": {
        "category_separate": 0.666667
      },
      "soft_utility": 0.666667,
      "hard_violations": [
        "electronics_heavy_contact:1"
      ]
    },
    {
      "candidate_id": "cand_30bfd4f68b8e",
      "geometry_score": 0.71332815,
      "semantic_score_components": {
        "category_separate": 0.666667
      },
      "soft_utility": 0.666667,
      "hard_violations": [
        "electronics_heavy_contact:1"
      ]
    },
    {
      "candidate_id": "cand_1d5f60072aa6",
      "geometry_score": 0.7124943,
      "semantic_score_components": {
        "category_separate": 1.0
      },
      "soft_utility": 1.0,
      "hard_violations": []
    },
    {
      "candidate_id": "cand_5ed30d4c90d4",
      "geometry_score": 0.7115283,
      "semantic_score_components": {
        "category_separate": 1.0
      },
      "soft_utility": 1.0,
      "hard_violations": []
    },
    {
      "candidate_id": "cand_13809b4055d9",
      "geometry_score": 0.70721535,
      "semantic_score_components": {
        "category_separate": 1.0
      },
      "soft_utility": 1.0,
      "hard_violations": []
    },
    {
      "candidate_id": "cand_9053eb3c5897",
      "geometry_score": 0.58449095,
      "semantic_score_components": {
        "category_separate": 1.0
      },
      "soft_utility": 1.0,
      "hard_violations": []
    },
    {
      "candidate_id": "cand_c6549d824682",
      "geometry_score": 0.5839916,
      "semantic_score_components": {
        "category_separate": 1.0
      },
      "soft_utility": 1.0,
      "hard_violations": []
    },
    {
      "candidate_id": "cand_bebd8cb56ba3",
      "geometry_score": 0.58382525,
      "semantic_score_components": {
        "category_separate": 1.0
      },
      "soft_utility": 1.0,
      "hard_violations": []
    },
    {
      "candidate_id": "cand_5cffc02e9b91",
      "geometry_score": 0.5782139,
      "semantic_score_components": {
        "category_separate": 1.0
      },
      "soft_utility": 1.0,
      "hard_violations": []
    },
    {
      "candidate_id": "cand_8cb71188a508",
      "geometry_score": 0.5772483,
      "semantic_score_components": {
        "category_separate": 1.0
      },
      "soft_utility": 1.0,
      "hard_violations": []
    },
    {
      "candidate_id": "cand_ca2d390afceb",
      "geometry_score": 0.5764932,
      "semantic_score_components": {
        "category_separate": 1.0
      },
      "soft_utility": 1.0,
      "hard_violations": []
    }
  ],
  "oracle_candidate_id": "cand_fee01764ccda",
  "semantic_utility_range": 0.333333,
  "semantic_decision_required": true
}
