{
  "schema_version": "1.0",
  "decision_case_id": "DC_00114",
  "candidate_set_id": "CSET_00114",
  "ground_truth_rule": {
    "rule_type": "heavy_low",
    "target_attribute": "weight_class=heavy",
    "priority": 1,
    "hard_or_soft": "soft",
    "thresholds": {},
    "canonical": "重物应尽量放在较低层。",
    "paraphrases": [
      "优先把较重的箱子安排在底部附近。",
      "请避免将重箱码放得过高。"
    ]
  },
  "geometry_reference": {
    "rejection_histogram": {
      "insufficient_support": 82,
      "out_of_bounds": 228,
      "overlap": 116
    },
    "pareto_candidate_fingerprints": [
      "046271972ee91ef9f3e39b90",
      "55a17ebbee4d90556f38e131",
      "903f842480b8f86507c62be6",
      "bc148fbc78c1644e281c871d"
    ],
    "pareto_recall_at_k": 1.0,
    "geometry_oracle_fingerprint": "bc148fbc78c1644e281c871d",
    "geometry_oracle_score": 0.74188545,
    "epsilon_optimal_recall_at_k": true
  },
  "candidate_evaluations": [
    {
      "candidate_id": "cand_bc148fbc78c1",
      "geometry_score": 0.74188545,
      "semantic_score_components": {
        "heavy_low": 1.0
      },
      "soft_utility": 1.0,
      "hard_violations": []
    },
    {
      "candidate_id": "cand_7289e23e3df2",
      "geometry_score": 0.73873425,
      "semantic_score_components": {
        "heavy_low": 1.0
      },
      "soft_utility": 1.0,
      "hard_violations": []
    },
    {
      "candidate_id": "cand_43d71cd97b9a",
      "geometry_score": 0.6313074,
      "semantic_score_components": {
        "heavy_low": 0.921311
      },
      "soft_utility": 0.921311,
      "hard_violations": []
    },
    {
      "candidate_id": "cand_feefcba2ea90",
      "geometry_score": 0.60924995,
      "semantic_score_components": {
        "heavy_low": 0.911475
      },
      "soft_utility": 0.911475,
      "hard_violations": []
    },
    {
      "candidate_id": "cand_95d7a6124c74",
      "geometry_score": 0.58068145,
      "semantic_score_components": {
        "heavy_low": 0.911475
      },
      "soft_utility": 0.911475,
      "hard_violations": []
    },
    {
      "candidate_id": "cand_55a17ebbee4d",
      "geometry_score": 0.73213065,
      "semantic_score_components": {
        "heavy_low": 1.0
      },
      "soft_utility": 1.0,
      "hard_violations": []
    },
    {
      "candidate_id": "cand_ee250c652793",
      "geometry_score": 0.7317345,
      "semantic_score_components": {
        "heavy_low": 1.0
      },
      "soft_utility": 1.0,
      "hard_violations": []
    },
    {
      "candidate_id": "cand_3d6a45249e2f",
      "geometry_score": 0.7314804,
      "semantic_score_components": {
        "heavy_low": 1.0
      },
      "soft_utility": 1.0,
      "hard_violations": []
    },
    {
      "candidate_id": "cand_27e61bed2be1",
      "geometry_score": 0.7303371,
      "semantic_score_components": {
        "heavy_low": 1.0
      },
      "soft_utility": 1.0,
      "hard_violations": []
    },
    {
      "candidate_id": "cand_c8368b407185",
      "geometry_score": 0.7297071,
      "semantic_score_components": {
        "heavy_low": 1.0
      },
      "soft_utility": 1.0,
      "hard_violations": []
    },
    {
      "candidate_id": "cand_73bf045e2a7f",
      "geometry_score": 0.72862835,
      "semantic_score_components": {
        "heavy_low": 1.0
      },
      "soft_utility": 1.0,
      "hard_violations": []
    },
    {
      "candidate_id": "cand_77d1a35114f1",
      "geometry_score": 0.7215412,
      "semantic_score_components": {
        "heavy_low": 1.0
      },
      "soft_utility": 1.0,
      "hard_violations": []
    },
    {
      "candidate_id": "cand_830f651e697c",
      "geometry_score": 0.7203784,
      "semantic_score_components": {
        "heavy_low": 1.0
      },
      "soft_utility": 1.0,
      "hard_violations": []
    },
    {
      "candidate_id": "cand_46bc147ee6db",
      "geometry_score": 0.7200625,
      "semantic_score_components": {
        "heavy_low": 1.0
      },
      "soft_utility": 1.0,
      "hard_violations": []
    },
    {
      "candidate_id": "cand_046271972ee9",
      "geometry_score": 0.71392725,
      "semantic_score_components": {
        "heavy_low": 1.0
      },
      "soft_utility": 1.0,
      "hard_violations": []
    },
    {
      "candidate_id": "cand_903f842480b8",
      "geometry_score": 0.7138919,
      "semantic_score_components": {
        "heavy_low": 1.0
      },
      "soft_utility": 1.0,
      "hard_violations": []
    }
  ],
  "oracle_candidate_id": "cand_bc148fbc78c1",
  "semantic_utility_range": 0.088525,
  "semantic_decision_required": false
}
