{
  "schema_version": "1.0",
  "decision_case_id": "DC_00017",
  "candidate_set_id": "CSET_00017",
  "ground_truth_rule": {
    "rule_type": "category_separate",
    "target_attribute": "product_category=electronics",
    "priority": 1,
    "hard_or_soft": "hard",
    "thresholds": {
      "separate_from": "weight_class=heavy",
      "contact_tolerance_mm": 0
    },
    "canonical": "电子产品箱不得与重物箱直接接触或形成上下支撑关系。",
    "paraphrases": [
      "必须将电子货箱和重箱隔开，不能相互贴靠或叠放。",
      "电子产品不可直接邻接重物，也不能与重物上下承托。"
    ]
  },
  "geometry_reference": {
    "rejection_histogram": {
      "insufficient_support": 82,
      "non_stackable_support": 2,
      "out_of_bounds": 196,
      "overlap": 50
    },
    "pareto_candidate_fingerprints": [
      "1358d27715280582f16c428e",
      "1ae9476c6af272e640d8b52d",
      "45c009cadf43094466737df2",
      "ad20030ccf1e63b65a9b7538",
      "ce8ac0d8e9e1b38f06ae903b",
      "d3011218ca4398c48f79c160",
      "ef8a018d27870fb4811c0ff5"
    ],
    "pareto_recall_at_k": 1.0,
    "geometry_oracle_fingerprint": "1358d27715280582f16c428e",
    "geometry_oracle_score": 0.7554158,
    "epsilon_optimal_recall_at_k": true
  },
  "candidate_evaluations": [
    {
      "candidate_id": "cand_1358d2771528",
      "geometry_score": 0.7554158,
      "semantic_score_components": {
        "category_separate": 0.666667
      },
      "soft_utility": 0.666667,
      "hard_violations": [
        "electronics_heavy_contact:1"
      ]
    },
    {
      "candidate_id": "cand_b1faf7a3ea36",
      "geometry_score": 0.75361205,
      "semantic_score_components": {
        "category_separate": 0.666667
      },
      "soft_utility": 0.666667,
      "hard_violations": [
        "electronics_heavy_contact:1"
      ]
    },
    {
      "candidate_id": "cand_4a0add125468",
      "geometry_score": 0.600244,
      "semantic_score_components": {
        "category_separate": 1.0
      },
      "soft_utility": 1.0,
      "hard_violations": []
    },
    {
      "candidate_id": "cand_ef8a018d2787",
      "geometry_score": 0.7508919,
      "semantic_score_components": {
        "category_separate": 0.333333
      },
      "soft_utility": 0.333333,
      "hard_violations": [
        "electronics_heavy_contact:2"
      ]
    },
    {
      "candidate_id": "cand_ce8ac0d8e9e1",
      "geometry_score": 0.7393832,
      "semantic_score_components": {
        "category_separate": 1.0
      },
      "soft_utility": 1.0,
      "hard_violations": []
    },
    {
      "candidate_id": "cand_1a9706c15499",
      "geometry_score": 0.72843205,
      "semantic_score_components": {
        "category_separate": 0.666667
      },
      "soft_utility": 0.666667,
      "hard_violations": [
        "electronics_heavy_contact:1"
      ]
    },
    {
      "candidate_id": "cand_cfdb243bb5d1",
      "geometry_score": 0.7182154,
      "semantic_score_components": {
        "category_separate": 1.0
      },
      "soft_utility": 1.0,
      "hard_violations": []
    },
    {
      "candidate_id": "cand_d3011218ca43",
      "geometry_score": 0.7133795,
      "semantic_score_components": {
        "category_separate": 0.333333
      },
      "soft_utility": 0.333333,
      "hard_violations": [
        "electronics_heavy_contact:2"
      ]
    },
    {
      "candidate_id": "cand_ad20030ccf1e",
      "geometry_score": 0.70741805,
      "semantic_score_components": {
        "category_separate": 1.0
      },
      "soft_utility": 1.0,
      "hard_violations": []
    },
    {
      "candidate_id": "cand_d4719e20cef5",
      "geometry_score": 0.7061564,
      "semantic_score_components": {
        "category_separate": 0.666667
      },
      "soft_utility": 0.666667,
      "hard_violations": [
        "electronics_heavy_contact:1"
      ]
    },
    {
      "candidate_id": "cand_52260cecfd05",
      "geometry_score": 0.69982085,
      "semantic_score_components": {
        "category_separate": 0.666667
      },
      "soft_utility": 0.666667,
      "hard_violations": [
        "electronics_heavy_contact:1"
      ]
    },
    {
      "candidate_id": "cand_1ae9476c6af2",
      "geometry_score": 0.6919845,
      "semantic_score_components": {
        "category_separate": 1.0
      },
      "soft_utility": 1.0,
      "hard_violations": []
    },
    {
      "candidate_id": "cand_9f7d74d74e01",
      "geometry_score": 0.6906984,
      "semantic_score_components": {
        "category_separate": 1.0
      },
      "soft_utility": 1.0,
      "hard_violations": []
    },
    {
      "candidate_id": "cand_f7e5a34a6c59",
      "geometry_score": 0.6893193,
      "semantic_score_components": {
        "category_separate": 1.0
      },
      "soft_utility": 1.0,
      "hard_violations": []
    },
    {
      "candidate_id": "cand_5f762ae03257",
      "geometry_score": 0.68917395,
      "semantic_score_components": {
        "category_separate": 1.0
      },
      "soft_utility": 1.0,
      "hard_violations": []
    },
    {
      "candidate_id": "cand_45c009cadf43",
      "geometry_score": 0.68371915,
      "semantic_score_components": {
        "category_separate": 1.0
      },
      "soft_utility": 1.0,
      "hard_violations": []
    }
  ],
  "oracle_candidate_id": "cand_ce8ac0d8e9e1",
  "semantic_utility_range": 0.666667,
  "semantic_decision_required": true
}
