{
  "schema_version": "1.0",
  "decision_case_id": "DC_00097",
  "candidate_set_id": "CSET_00097",
  "ground_truth_rule": {
    "rule_type": "heavy_low",
    "target_attribute": "weight_class=heavy",
    "priority": 1,
    "hard_or_soft": "soft",
    "thresholds": {},
    "canonical": "重物应尽量放在较低层。",
    "paraphrases": [
      "优先把较重的箱子安排在底部附近。",
      "请避免将重箱码放得过高。"
    ]
  },
  "geometry_reference": {
    "rejection_histogram": {
      "insufficient_support": 41,
      "out_of_bounds": 82,
      "overlap": 5
    },
    "pareto_candidate_fingerprints": [
      "23d7c5df30620334049ca0cf",
      "2a5b42792f24660f62168c29",
      "37ad026a732be5c0dfe3b372",
      "3e1a591e8983448f1f758eeb",
      "96e654da05c6adcb567088a4",
      "9c231060d0edc82169500f3b",
      "a6fd2a4d88aef40c1161944f",
      "a8f16a0ca5864efe48546878",
      "c14591986308282252a670d4",
      "c4647e2c19ce321c7699826a",
      "cc184e3dc4de579728fcd32a",
      "ec31f8b0e76a101ffdeb928e",
      "f368e46aa967b236821637bb"
    ],
    "pareto_recall_at_k": 1.0,
    "geometry_oracle_fingerprint": "f368e46aa967b236821637bb",
    "geometry_oracle_score": 0.76229995,
    "epsilon_optimal_recall_at_k": true
  },
  "candidate_evaluations": [
    {
      "candidate_id": "cand_f368e46aa967",
      "geometry_score": 0.76229995,
      "semantic_score_components": {
        "heavy_low": 1.0
      },
      "soft_utility": 1.0,
      "hard_violations": []
    },
    {
      "candidate_id": "cand_96e654da05c6",
      "geometry_score": 0.7084816,
      "semantic_score_components": {
        "heavy_low": 1.0
      },
      "soft_utility": 1.0,
      "hard_violations": []
    },
    {
      "candidate_id": "cand_3e1a591e8983",
      "geometry_score": 0.68340685,
      "semantic_score_components": {
        "heavy_low": 0.629464
      },
      "soft_utility": 0.629464,
      "hard_violations": []
    },
    {
      "candidate_id": "cand_c4647e2c19ce",
      "geometry_score": 0.7600356,
      "semantic_score_components": {
        "heavy_low": 1.0
      },
      "soft_utility": 1.0,
      "hard_violations": []
    },
    {
      "candidate_id": "cand_4908fce8e1f5",
      "geometry_score": 0.75453765,
      "semantic_score_components": {
        "heavy_low": 1.0
      },
      "soft_utility": 1.0,
      "hard_violations": []
    },
    {
      "candidate_id": "cand_6d6987b033a5",
      "geometry_score": 0.70121455,
      "semantic_score_components": {
        "heavy_low": 1.0
      },
      "soft_utility": 1.0,
      "hard_violations": []
    },
    {
      "candidate_id": "cand_d1fd8ce7282f",
      "geometry_score": 0.69620625,
      "semantic_score_components": {
        "heavy_low": 1.0
      },
      "soft_utility": 1.0,
      "hard_violations": []
    },
    {
      "candidate_id": "cand_a6fd2a4d88ae",
      "geometry_score": 0.67830885,
      "semantic_score_components": {
        "heavy_low": 0.629464
      },
      "soft_utility": 0.629464,
      "hard_violations": []
    },
    {
      "candidate_id": "cand_37ad026a732b",
      "geometry_score": 0.67160295,
      "semantic_score_components": {
        "heavy_low": 1.0
      },
      "soft_utility": 1.0,
      "hard_violations": []
    },
    {
      "candidate_id": "cand_c14591986308",
      "geometry_score": 0.6681113,
      "semantic_score_components": {
        "heavy_low": 0.629464
      },
      "soft_utility": 0.629464,
      "hard_violations": []
    },
    {
      "candidate_id": "cand_a8f16a0ca586",
      "geometry_score": 0.6632873,
      "semantic_score_components": {
        "heavy_low": 0.629464
      },
      "soft_utility": 0.629464,
      "hard_violations": []
    },
    {
      "candidate_id": "cand_ec31f8b0e76a",
      "geometry_score": 0.6429038,
      "semantic_score_components": {
        "heavy_low": 1.0
      },
      "soft_utility": 1.0,
      "hard_violations": []
    },
    {
      "candidate_id": "cand_23d7c5df3062",
      "geometry_score": 0.6420191,
      "semantic_score_components": {
        "heavy_low": 1.0
      },
      "soft_utility": 1.0,
      "hard_violations": []
    },
    {
      "candidate_id": "cand_9c231060d0ed",
      "geometry_score": 0.6386089,
      "semantic_score_components": {
        "heavy_low": 1.0
      },
      "soft_utility": 1.0,
      "hard_violations": []
    },
    {
      "candidate_id": "cand_cc184e3dc4de",
      "geometry_score": 0.62518835,
      "semantic_score_components": {
        "heavy_low": 1.0
      },
      "soft_utility": 1.0,
      "hard_violations": []
    },
    {
      "candidate_id": "cand_2a5b42792f24",
      "geometry_score": 0.6247473,
      "semantic_score_components": {
        "heavy_low": 1.0
      },
      "soft_utility": 1.0,
      "hard_violations": []
    }
  ],
  "oracle_candidate_id": "cand_f368e46aa967",
  "semantic_utility_range": 0.370536,
  "semantic_decision_required": false
}
