{
  "schema_version": "1.0",
  "decision_case_id": "DC_00064",
  "candidate_set_id": "CSET_00064",
  "ground_truth_rule": {
    "rule_type": "category_group",
    "target_attribute": "product_category=electronics",
    "priority": 1,
    "hard_or_soft": "soft",
    "thresholds": {},
    "canonical": "电子产品箱应尽量集中码放。",
    "paraphrases": [
      "请把电子类货箱放得相对集中。",
      "尽量不要把电子产品分散在托盘各处。"
    ]
  },
  "geometry_reference": {
    "rejection_histogram": {
      "insufficient_support": 117,
      "out_of_bounds": 244,
      "overlap": 112
    },
    "pareto_candidate_fingerprints": [
      "50ec10869ed53e3b3c5fafac",
      "647699aeb23ec46d43782c8a",
      "a5014542fa56072146c0243e",
      "ac5cb5728a779a2f1989f605",
      "b4bfa403c07a10c231386fbb",
      "e08631ac3967de00a4f87714"
    ],
    "pareto_recall_at_k": 0.666667,
    "geometry_oracle_fingerprint": "647699aeb23ec46d43782c8a",
    "geometry_oracle_score": 0.7691479,
    "epsilon_optimal_recall_at_k": true
  },
  "candidate_evaluations": [
    {
      "candidate_id": "cand_647699aeb23e",
      "geometry_score": 0.7691479,
      "semantic_score_components": {
        "category_group": 0.54419
      },
      "soft_utility": 0.54419,
      "hard_violations": []
    },
    {
      "candidate_id": "cand_1ce60d276864",
      "geometry_score": 0.7686562,
      "semantic_score_components": {
        "category_group": 0.507318
      },
      "soft_utility": 0.507318,
      "hard_violations": []
    },
    {
      "candidate_id": "cand_abb199f974a4",
      "geometry_score": 0.6172011,
      "semantic_score_components": {
        "category_group": 0.85942
      },
      "soft_utility": 0.85942,
      "hard_violations": []
    },
    {
      "candidate_id": "cand_7755b546615a",
      "geometry_score": 0.58320325,
      "semantic_score_components": {
        "category_group": 0.59593
      },
      "soft_utility": 0.59593,
      "hard_violations": []
    },
    {
      "candidate_id": "cand_91292f2ba501",
      "geometry_score": 0.57759265,
      "semantic_score_components": {
        "category_group": 0.743573
      },
      "soft_utility": 0.743573,
      "hard_violations": []
    },
    {
      "candidate_id": "cand_a23fa6903446",
      "geometry_score": 0.56563995,
      "semantic_score_components": {
        "category_group": 0.547148
      },
      "soft_utility": 0.547148,
      "hard_violations": []
    },
    {
      "candidate_id": "cand_8fa34999eb0c",
      "geometry_score": 0.7687777,
      "semantic_score_components": {
        "category_group": 0.740447
      },
      "soft_utility": 0.740447,
      "hard_violations": []
    },
    {
      "candidate_id": "cand_b4bfa403c07a",
      "geometry_score": 0.7509228,
      "semantic_score_components": {
        "category_group": 0.530857
      },
      "soft_utility": 0.530857,
      "hard_violations": []
    },
    {
      "candidate_id": "cand_c0163d74b318",
      "geometry_score": 0.7505325,
      "semantic_score_components": {
        "category_group": 0.717689
      },
      "soft_utility": 0.717689,
      "hard_violations": []
    },
    {
      "candidate_id": "cand_f7aa40f58c27",
      "geometry_score": 0.7504044,
      "semantic_score_components": {
        "category_group": 0.494958
      },
      "soft_utility": 0.494958,
      "hard_violations": []
    },
    {
      "candidate_id": "cand_72004b321968",
      "geometry_score": 0.74967,
      "semantic_score_components": {
        "category_group": 0.750891
      },
      "soft_utility": 0.750891,
      "hard_violations": []
    },
    {
      "candidate_id": "cand_7acb812b1b6f",
      "geometry_score": 0.74395965,
      "semantic_score_components": {
        "category_group": 0.790163
      },
      "soft_utility": 0.790163,
      "hard_violations": []
    },
    {
      "candidate_id": "cand_ac5cb5728a77",
      "geometry_score": 0.70447285,
      "semantic_score_components": {
        "category_group": 0.673853
      },
      "soft_utility": 0.673853,
      "hard_violations": []
    },
    {
      "candidate_id": "cand_e08631ac3967",
      "geometry_score": 0.70358575,
      "semantic_score_components": {
        "category_group": 0.575717
      },
      "soft_utility": 0.575717,
      "hard_violations": []
    },
    {
      "candidate_id": "cand_f207dd0137ba",
      "geometry_score": 0.7029691,
      "semantic_score_components": {
        "category_group": 0.669759
      },
      "soft_utility": 0.669759,
      "hard_violations": []
    },
    {
      "candidate_id": "cand_bd98d472909b",
      "geometry_score": 0.7026487,
      "semantic_score_components": {
        "category_group": 0.733386
      },
      "soft_utility": 0.733386,
      "hard_violations": []
    }
  ],
  "oracle_candidate_id": "cand_abb199f974a4",
  "semantic_utility_range": 0.364462,
  "semantic_decision_required": true
}
